<?xml version="1.0" encoding="UTF-8" ?>
        <!--
  ~ Copyright (C) 2016-2020 ActionTech.
  ~ License: http://www.gnu.org/licenses/gpl.html GPL version 2 or higher.
  -->

        <!--
         -
         - Licensed under the Apache License, Version 2.0 (the "License");
         - you may not use this file except in compliance with the License.
         - You may obtain a copy of the License at
         -
         -      http://www.apache.org/licenses/LICENSE-2.0
         -
         - Unless required by applicable law or agreed to in writing, software
         - distributed under the License is distributed on an "AS IS" BASIS,
         - WITHOUT WARRANTIES OR CONDITIONS OF ANY KIND, either express or implied.
         - See the License for the specific language governing permissions and
         - limitations under the License.
        -->
        <!ELEMENT dble:user (managerUser+,shardingUser*,rwSplitUser*,blacklist*)>
        <!ATTLIST dble:user xmlns:dble CDATA #FIXED "http://dble.cloud/">
        <!ATTLIST dble:user version CDATA #IMPLIED>


        <!ELEMENT managerUser EMPTY>
        <!ATTLIST managerUser name NMTOKEN #REQUIRED>
        <!ATTLIST managerUser password CDATA #REQUIRED>
        <!ATTLIST managerUser usingDecrypt NMTOKEN #IMPLIED>
        <!ATTLIST managerUser whiteIPs CDATA #IMPLIED>
        <!ATTLIST managerUser readOnly NMTOKEN #IMPLIED>
        <!ATTLIST managerUser maxCon NMTOKEN #IMPLIED>

        <!ELEMENT rwSplitUser EMPTY>
        <!ATTLIST rwSplitUser name NMTOKEN #REQUIRED>
        <!ATTLIST rwSplitUser tenant NMTOKEN #IMPLIED>
        <!ATTLIST rwSplitUser dbGroup NMTOKEN #REQUIRED>
        <!ATTLIST rwSplitUser password CDATA #REQUIRED>
        <!ATTLIST rwSplitUser usingDecrypt NMTOKEN #IMPLIED>
        <!ATTLIST rwSplitUser whiteIPs CDATA #IMPLIED>
        <!ATTLIST rwSplitUser maxCon NMTOKEN #IMPLIED>
        <!ATTLIST rwSplitUser blacklist NMTOKEN #IMPLIED>

        <!ELEMENT shardingUser (privileges?)>
        <!ATTLIST shardingUser name NMTOKEN #REQUIRED>
        <!ATTLIST shardingUser tenant NMTOKEN #IMPLIED>
        <!ATTLIST shardingUser schemas CDATA #REQUIRED>
        <!ATTLIST shardingUser password CDATA #REQUIRED>
        <!ATTLIST shardingUser usingDecrypt NMTOKEN #IMPLIED>
        <!ATTLIST shardingUser whiteIPs CDATA #IMPLIED>
        <!ATTLIST shardingUser maxCon NMTOKEN #IMPLIED>
        <!ATTLIST shardingUser readOnly NMTOKEN #IMPLIED>
        <!ATTLIST shardingUser blacklist NMTOKEN #IMPLIED>

        <!ELEMENT privileges (schema)*>
        <!ATTLIST privileges check NMTOKEN #REQUIRED>

        <!ELEMENT schema (table)*>
        <!ATTLIST schema
                name NMTOKEN #REQUIRED
                dml NMTOKEN #REQUIRED>

        <!ELEMENT table EMPTY>
        <!ATTLIST table
                name NMTOKEN #REQUIRED
                dml NMTOKEN #REQUIRED>

        <!ELEMENT blacklist (property*)>
        <!ATTLIST blacklist name NMTOKEN #REQUIRED>

        <!ELEMENT property (#PCDATA)*>
        <!ATTLIST property name NMTOKEN #REQUIRED>